{
  "$schema": "https://json-schema.org/draft/2020-12/schema",
  "$id": "urn:agentic-identity-broker:events:v1:envelope",
  "title": "Broker business event envelope",
  "type": "object",
  "additionalProperties": false,
  "required": [
    "id",
    "type",
    "source",
    "occurred_at",
    "recorded_at",
    "subject",
    "actor",
    "outcome",
    "reason_user",
    "reason_admin",
    "data"
  ],
  "properties": {
    "id": {
      "type": "string",
      "pattern": "^[0-9a-f]{8}-[0-9a-f]{4}-7[0-9a-f]{3}-[89ab][0-9a-f]{3}-[0-9a-f]{12}$"
    },
    "type": {
      "type": "string",
      "pattern": "^agentic-identity-broker\\.[a-z][a-z0-9-]*$"
    },
    "source": {
      "const": "urn:agentic-identity-broker:broker"
    },
    "occurred_at": {
      "type": "string",
      "pattern": "^\\d{4}-\\d{2}-\\d{2}T\\d{2}:\\d{2}:\\d{2}(\\.\\d{1,9})?Z$"
    },
    "recorded_at": {
      "type": "string",
      "pattern": "^\\d{4}-\\d{2}-\\d{2}T\\d{2}:\\d{2}:\\d{2}(\\.\\d{1,9})?Z$"
    },
    "subject": {
      "type": [
        "string",
        "null"
      ],
      "minLength": 1
    },
    "actor": {
      "type": "object",
      "additionalProperties": false,
      "required": [
        "kind",
        "id",
        "on_behalf_of"
      ],
      "properties": {
        "kind": {
          "enum": [
            "user",
            "admin",
            "agent",
            "gateway",
            "system",
            "policy"
          ]
        },
        "id": {
          "type": [
            "string",
            "null"
          ],
          "minLength": 1
        },
        "on_behalf_of": {
          "type": [
            "string",
            "null"
          ],
          "minLength": 1
        }
      }
    },
    "gateway_client_id": {
      "type": "string",
      "minLength": 1
    },
    "permission_set_ids": {
      "type": "array",
      "uniqueItems": true,
      "items": {
        "type": "string",
        "pattern": "^[0-9a-f]{8}-[0-9a-f]{4}-[0-9a-f]{4}-[0-9a-f]{4}-[0-9a-f]{12}$"
      }
    },
    "mcp_session_id": {
      "type": "string",
      "minLength": 1
    },
    "agent_session_id": {
      "type": "string",
      "minLength": 1
    },
    "outcome": {
      "enum": [
        "success",
        "failure",
        "denied",
        "pending"
      ]
    },
    "reason_user": {
      "type": "string",
      "minLength": 1
    },
    "reason_admin": {
      "type": "string",
      "minLength": 1
    },
    "trace_id": {
      "type": "string",
      "pattern": "^[0-9a-f]{32}$"
    },
    "span_id": {
      "type": "string",
      "pattern": "^[0-9a-f]{16}$"
    },
    "client": {
      "type": "object",
      "additionalProperties": false,
      "minProperties": 1,
      "properties": {
        "ip": {
          "type": "string",
          "minLength": 1
        },
        "user_agent": {
          "enum": [
            "Chrome",
            "Firefox",
            "Safari",
            "Edge",
            "curl",
            "Go-http-client"
          ]
        }
      }
    },
    "data": {
      "type": "object"
    },
    "agent_id": {
      "type": "string",
      "pattern": "^[0-9a-f]{8}-[0-9a-f]{4}-[0-9a-f]{4}-[0-9a-f]{4}-[0-9a-f]{12}$"
    },
    "service_id": {
      "type": "string",
      "pattern": "^[0-9a-f]{8}-[0-9a-f]{4}-[0-9a-f]{4}-[0-9a-f]{4}-[0-9a-f]{12}$"
    },
    "grant_id": {
      "type": "string",
      "pattern": "^[0-9a-f]{8}-[0-9a-f]{4}-[0-9a-f]{4}-[0-9a-f]{4}-[0-9a-f]{12}$"
    },
    "session_id": {
      "type": "string",
      "pattern": "^[0-9a-f]{8}-[0-9a-f]{4}-[0-9a-f]{4}-[0-9a-f]{4}-[0-9a-f]{12}$"
    },
    "approval_id": {
      "type": "string",
      "pattern": "^[0-9a-f]{8}-[0-9a-f]{4}-[0-9a-f]{4}-[0-9a-f]{4}-[0-9a-f]{12}$"
    }
  }
}
